{
  "contract_version":"federation-spatial-manifest/1.0",
  "producer_repo":"spiderweb-pr",
  "authority":"cross-domain investigation and spatial evidence fusion",
  "frozen_base_sha":"533fdde554e11b486a4ddb7a3fbe8127ed3fa2b2",
  "branch":"feat/federation-gis-max-v1",
  "contracts":{
    "feature":"schemas/federation_spatial_feature_v1.schema.json",
    "layer":"schemas/federation_spatial_layer_v1.schema.json",
    "map_runtime":"schemas/maplibre_layer_runtime_v1.schema.json",
    "offline_package":"schemas/fedgeopack_v1.schema.json",
    "impact_report":"schemas/federation_spatial_impact_report_v1.schema.json"
  },
  "storage":{"postgis_migration":"migrations/20260831_federation_spatial_v1.sql","mvt_migration":"migrations/20260831_federation_mvt_v1.sql","ownership":"REPO_LOCAL"},
  "domain_extensions":["federation/spatial_core.py","federation/spatial_relations.py","federation/fedgeopack.py","pipeline/gis_intelligence.py","server/frontend/src/modules/SpatialIntelligence.tsx"],
  "cross_repo":{"identity_default":"CANDIDATE_NOT_IDENTITY","hub_correlation_authority":"thehub-pr","consumer_contract":"federation-spatial-contract/1.0"},
  "gates":{"schema":"OPEN","geometry":"OPEN","tests":"OPEN","postgis":"OPEN","security":"OPEN","performance":"OPEN","desktop":"OPEN","ios":"OPEN","federation":"BLOCKED"}
}